{
  "$schema": "https://json-schema.org/draft/2020-12/schema",
  "$id": "https://media-monitor/contracts/news_yt_script_draft.v1.json",
  "title": "news_yt_script_draft.v1",
  "description": "YouTube-focused draft script generated from a brief.",
  "type": "object",
  "additionalProperties": false,
  "properties": {
    "schema_name": { "const": "news_yt_script_draft.v1" },
    "schema_status": { "const": "experimental_structured" },
    "script_id": { "type": "string", "minLength": 1 },
    "brief_id": { "type": "string", "minLength": 1 },
    "title": { "type": "string", "minLength": 1 },
    "thumbnail_hook": { "type": "string", "minLength": 1 },
    "cold_open": { "type": "string", "minLength": 1 },
    "segment_outline": {
      "type": "array",
      "minItems": 1,
      "items": {
        "type": "object",
        "additionalProperties": false,
        "properties": {
          "segment_id": { "type": "string", "minLength": 1 },
          "heading": { "type": "string", "minLength": 1 },
          "beat": { "type": "string", "minLength": 1 },
          "estimated_seconds": { "type": "integer", "minimum": 1 }
        },
        "required": ["segment_id", "heading", "beat", "estimated_seconds"]
      }
    },
    "full_script": { "type": "string", "minLength": 1 },
    "voice_notes": {
      "type": "array",
      "items": { "type": "string", "minLength": 1 }
    },
    "visual_notes": {
      "type": "array",
      "items": {
        "type": "object",
        "additionalProperties": false,
        "properties": {
          "segment_id": { "type": "string", "minLength": 1 },
          "direction": { "type": "string", "minLength": 1 },
          "asset_refs": {
            "type": "array",
            "items": { "type": "string", "minLength": 1 }
          }
        },
        "required": ["segment_id", "direction", "asset_refs"]
      }
    },
    "citations": {
      "type": "array",
      "items": {
        "type": "object",
        "additionalProperties": false,
        "properties": {
          "source_ref_id": { "type": "string", "minLength": 1 },
          "url": { "type": "string", "format": "uri" },
          "usage_note": { "type": "string", "minLength": 1 }
        },
        "required": ["source_ref_id", "url", "usage_note"]
      }
    }
  },
  "required": [
    "schema_name",
    "schema_status",
    "script_id",
    "brief_id",
    "title",
    "thumbnail_hook",
    "cold_open",
    "segment_outline",
    "full_script",
    "voice_notes",
    "visual_notes",
    "citations"
  ]
}
